{
  "$schema": "https://json-schema.org/draft/2020-12/schema",
  "$id": "https://qel.example/spec/0.1/qel-core.schema.json",
  "title": "Quantum Expression Language Core Expression",
  "type": "object",
  "additionalProperties": false,
  "required": [
    "qel_version", "id", "kind", "type", "status", "issuer",
    "subject", "place", "time", "authority", "consent",
    "evidence", "relationships", "payload", "proof"
  ],
  "properties": {
    "qel_version": { "const": "0.1.0" },
    "id": { "type": "string", "pattern": "^urn:qel:expression:[A-Za-z0-9._:-]+$" },
    "kind": { "enum": ["observation", "action", "state", "authorization", "attestation"] },
    "type": { "type": "string", "pattern": "^[a-z0-9]+(?:[.-][a-z0-9]+)*\\.v[1-9][0-9]*$" },
    "status": {
      "enum": ["proposed", "asserted", "attested", "verified", "accepted", "disputed", "corrected", "revoked", "superseded", "rejected"]
    },
    "issuer": { "$ref": "#/$defs/party" },
    "actor": { "$ref": "#/$defs/party" },
    "observer": { "$ref": "#/$defs/party" },
    "beneficiary": { "$ref": "#/$defs/party" },
    "subject": {
      "type": "object",
      "additionalProperties": false,
      "required": ["id", "type"],
      "properties": {
        "id": { "type": "string", "minLength": 3 },
        "type": { "type": "string", "minLength": 1 }
      }
    },
    "transition": {
      "type": "object",
      "additionalProperties": false,
      "required": ["from", "to"],
      "properties": {
        "from": { "type": ["string", "null"] },
        "to": { "type": "string", "minLength": 1 }
      }
    },
    "place": {
      "type": "object",
      "additionalProperties": false,
      "required": ["node", "jurisdiction"],
      "properties": {
        "node": { "type": "string", "minLength": 3 },
        "jurisdiction": { "type": "string", "pattern": "^[A-Z]{2}(?:-[A-Z0-9]{1,3})?$" }
      }
    },
    "time": {
      "type": "object",
      "additionalProperties": false,
      "required": ["occurred_at", "issued_at"],
      "properties": {
        "occurred_at": { "type": "string", "format": "date-time" },
        "observed_at": { "type": "string", "format": "date-time" },
        "issued_at": { "type": "string", "format": "date-time" },
        "effective_from": { "type": "string", "format": "date-time" },
        "effective_until": { "type": "string", "format": "date-time" }
      }
    },
    "authority": {
      "type": "array",
      "minItems": 1,
      "items": {
        "type": "object",
        "additionalProperties": false,
        "required": ["type", "reference", "scope"],
        "properties": {
          "type": { "type": "string", "minLength": 1 },
          "reference": { "type": "string", "minLength": 3 },
          "scope": { "type": "array", "minItems": 1, "items": { "type": "string", "minLength": 1 } }
        }
      }
    },
    "consent": {
      "type": "object",
      "additionalProperties": false,
      "required": ["status", "basis"],
      "properties": {
        "status": { "enum": ["granted", "denied", "revoked", "not-applicable", "unknown"] },
        "basis": { "type": "string", "minLength": 1 },
        "reference": { "type": "string" }
      }
    },
    "evidence": {
      "type": "array",
      "minItems": 1,
      "items": {
        "type": "object",
        "additionalProperties": false,
        "required": ["type", "digest", "location"],
        "properties": {
          "type": { "type": "string", "minLength": 1 },
          "digest": { "type": "string", "pattern": "^sha256:[a-f0-9]{64}$" },
          "location": { "type": "string", "minLength": 3 },
          "media_type": { "type": "string" }
        }
      }
    },
    "relationships": {
      "type": "array",
      "items": {
        "type": "object",
        "additionalProperties": false,
        "required": ["relation", "expression"],
        "properties": {
          "relation": { "enum": ["authorizes", "caused_by", "attests", "corrects", "disputes", "revokes", "supersedes"] },
          "expression": { "type": "string", "pattern": "^urn:qel:expression:" }
        }
      }
    },
    "payload": { "type": "object" },
    "proof": {
      "type": "array",
      "minItems": 1,
      "items": {
        "type": "object",
        "additionalProperties": false,
        "required": ["type", "verification_method", "created", "payload_digest", "proof_value"],
        "properties": {
          "type": { "enum": ["DataIntegrityProof", "DetachedJws", "MockProof"] },
          "verification_method": { "type": "string", "minLength": 3 },
          "created": { "type": "string", "format": "date-time" },
          "payload_digest": { "type": "string", "pattern": "^sha256:[a-f0-9]{64}$" },
          "proof_value": { "type": "string", "minLength": 3 }
        }
      }
    }
  },
  "$defs": {
    "party": {
      "type": "object",
      "additionalProperties": false,
      "required": ["id", "role"],
      "properties": {
        "id": { "type": "string", "minLength": 3 },
        "role": { "type": "string", "minLength": 1 }
      }
    }
  }
}
