{
  "qel_version": "0.1.0",
  "id": "urn:qel:expression:voi-pilot-001-product-received",
  "kind": "observation",
  "type": "org.virtualsilkroad.inventory.product-received.v1",
  "status": "attested",
  "issuer": { "id": "did:example:voi-pilot-operator", "role": "warehouse-receiving-authority" },
  "actor": { "id": "did:example:voi-pilot-operator", "role": "receiving-operator" },
  "subject": { "id": "urn:voi:batch:aw26-00421", "type": "product-batch" },
  "transition": { "from": "in-transit", "to": "received" },
  "place": { "node": "urn:vsr:node:voi-pilot-bangalore-001", "jurisdiction": "IN-KA" },
  "time": {
    "occurred_at": "2026-07-21T10:30:00+05:30",
    "observed_at": "2026-07-21T10:30:00+05:30",
    "issued_at": "2026-07-21T10:30:00+05:30"
  },
  "authority": [{
    "type": "warehouse-receiving-mandate",
    "reference": "urn:empireos:license:voi-warehouse-receiving-v1",
    "scope": ["receive-product", "record-custody"]
  }],
  "consent": { "status": "not-applicable", "basis": "commercial-and-operational-record" },
  "evidence": [{
    "type": "goods-receipt-note",
    "digest": "sha256:68fd4ef90ac93da7ef42fb2c6d80d7ade6a9861d4edb78b2ee2de1df29fbde0b",
    "location": "riveros://voi-pilot/evidence/001",
    "media_type": "application/json"
  }],
  "relationships": [],
  "payload": {
    "sku_count": 12,
    "unit_count": 571,
    "source_node": "urn:vsr:node:factory-001",
    "destination_node": "urn:vsr:node:voi-pilot-bangalore-001",
    "document_reference": "GRN-PILOT-0001"
  },
  "proof": [{
    "type": "MockProof",
    "verification_method": "did:example:voi-pilot-operator#test-key-1",
    "created": "2026-07-21T10:30:00+05:30",
    "payload_digest": "sha256:4e24127d1ec2e68283fc58306bbbfaf0a5ac618da87f26fa57c39c1298396b39",
    "proof_value": "mock:001:57c39c1298396b39"
  }]
}
